{
  "schemaVersion": "activation-energy-studio/external-evidence-adjudication-input/v1",
  "adjudicationId": "REPLACE_WITH_UNIQUE_ADJUDICATION_ID",
  "release": {
    "path": "REPLACE_WITH_LOCKED_RELEASE_RELATIVE_PATH",
    "sha256": "REPLACE_WITH_RELEASE_SHA256"
  },
  "acceptanceCriteria": {
    "path": "REPLACE_WITH_ACCEPTANCE_CRITERIA_RELATIVE_PATH",
    "sha256": "REPLACE_WITH_ACCEPTANCE_CRITERIA_SHA256"
  },
  "lanes": {
    "scientific": {
      "evidenceRecord": {
        "path": "REPLACE_WITH_SCIENTIFIC_EVIDENCE_RECORD_PATH",
        "sha256": "REPLACE_WITH_SCIENTIFIC_EVIDENCE_RECORD_SHA256"
      },
      "humanAudit": {
        "path": "REPLACE_WITH_SCIENTIFIC_HUMAN_AUDIT_PATH",
        "sha256": "REPLACE_WITH_SCIENTIFIC_HUMAN_AUDIT_SHA256"
      },
      "signedAudit": {
        "path": "REPLACE_WITH_SCIENTIFIC_SIGNED_AUDIT_PATH",
        "sha256": "REPLACE_WITH_SCIENTIFIC_SIGNED_AUDIT_SHA256"
      },
      "adjudicator": {
        "name": "REPLACE_WITH_INDEPENDENT_HUMAN_NAME",
        "organization": "REPLACE_WITH_ORGANIZATION",
        "professionalReference": "REPLACE_WITH_VERIFIABLE_PROFESSIONAL_REFERENCE",
        "isHumanAdjudicator": true,
        "independentFromProject": true,
        "notProjectContributor": true,
        "noConflictOfInterest": true
      },
      "review": {
        "startedAtUtc": "REPLACE_WITH_ISO_8601_UTC_START",
        "endedAtUtc": "REPLACE_WITH_ISO_8601_UTC_END",
        "signatureUtc": "REPLACE_WITH_ISO_8601_UTC_SIGNATURE_TIME",
        "reviewReference": "REPLACE_WITH_REVIEW_REFERENCE",
        "signatureMethod": "PGP_DETACHED_SIGNATURE",
        "signatureVerificationReference": "REPLACE_WITH_INDEPENDENT_SIGNATURE_VERIFICATION_REFERENCE"
      },
      "gateDecisions": [
        {
          "gateId": "AC-SCI-03",
          "contentDecision": "NOT_VERIFIED",
          "authenticityDecision": "NOT_VERIFIED",
          "evidenceReference": "REPLACE_WITH_EXACT_EVIDENCE_REFERENCE",
          "rationale": "REPLACE_WITH_COMPLETED_HUMAN_RATIONALE"
        },
        {
          "gateId": "AC-VAL-05",
          "contentDecision": "NOT_VERIFIED",
          "authenticityDecision": "NOT_VERIFIED",
          "evidenceReference": "REPLACE_WITH_EXACT_EVIDENCE_REFERENCE",
          "rationale": "REPLACE_WITH_COMPLETED_HUMAN_RATIONALE"
        }
      ]
    },
    "platform": {
      "evidenceRecord": {
        "path": "REPLACE_WITH_PLATFORM_HUMAN_REVIEW_RECORD_PATH",
        "sha256": "REPLACE_WITH_PLATFORM_HUMAN_REVIEW_RECORD_SHA256"
      },
      "humanAudit": {
        "path": "REPLACE_WITH_PLATFORM_HUMAN_AUDIT_PATH",
        "sha256": "REPLACE_WITH_PLATFORM_HUMAN_AUDIT_SHA256"
      },
      "signedAudit": {
        "path": "REPLACE_WITH_PLATFORM_SIGNED_AUDIT_PATH",
        "sha256": "REPLACE_WITH_PLATFORM_SIGNED_AUDIT_SHA256"
      },
      "adjudicator": {
        "name": "REPLACE_WITH_INDEPENDENT_HUMAN_NAME",
        "organization": "REPLACE_WITH_ORGANIZATION",
        "professionalReference": "REPLACE_WITH_VERIFIABLE_PROFESSIONAL_REFERENCE",
        "isHumanAdjudicator": true,
        "independentFromProject": true,
        "notProjectContributor": true,
        "noConflictOfInterest": true
      },
      "review": {
        "startedAtUtc": "REPLACE_WITH_ISO_8601_UTC_START",
        "endedAtUtc": "REPLACE_WITH_ISO_8601_UTC_END",
        "signatureUtc": "REPLACE_WITH_ISO_8601_UTC_SIGNATURE_TIME",
        "reviewReference": "REPLACE_WITH_REVIEW_REFERENCE",
        "signatureMethod": "PGP_DETACHED_SIGNATURE",
        "signatureVerificationReference": "REPLACE_WITH_INDEPENDENT_SIGNATURE_VERIFICATION_REFERENCE"
      },
      "gateDecisions": [
        {
          "gateId": "AC-PLAT-01",
          "contentDecision": "NOT_VERIFIED",
          "authenticityDecision": "NOT_VERIFIED",
          "evidenceReference": "REPLACE_WITH_EXACT_EVIDENCE_REFERENCE",
          "rationale": "REPLACE_WITH_COMPLETED_HUMAN_RATIONALE"
        },
        {
          "gateId": "AC-PLAT-02",
          "contentDecision": "NOT_VERIFIED",
          "authenticityDecision": "NOT_VERIFIED",
          "evidenceReference": "REPLACE_WITH_EXACT_EVIDENCE_REFERENCE",
          "rationale": "REPLACE_WITH_COMPLETED_HUMAN_RATIONALE"
        }
      ]
    },
    "usability": {
      "evidenceRecord": {
        "path": "REPLACE_WITH_USABILITY_EVIDENCE_RECORD_PATH",
        "sha256": "REPLACE_WITH_USABILITY_EVIDENCE_RECORD_SHA256"
      },
      "humanAudit": {
        "path": "REPLACE_WITH_USABILITY_HUMAN_AUDIT_PATH",
        "sha256": "REPLACE_WITH_USABILITY_HUMAN_AUDIT_SHA256"
      },
      "signedAudit": {
        "path": "REPLACE_WITH_USABILITY_SIGNED_AUDIT_PATH",
        "sha256": "REPLACE_WITH_USABILITY_SIGNED_AUDIT_SHA256"
      },
      "adjudicator": {
        "name": "REPLACE_WITH_INDEPENDENT_HUMAN_NAME",
        "organization": "REPLACE_WITH_ORGANIZATION",
        "professionalReference": "REPLACE_WITH_VERIFIABLE_PROFESSIONAL_REFERENCE",
        "isHumanAdjudicator": true,
        "independentFromProject": true,
        "notProjectContributor": true,
        "noConflictOfInterest": true
      },
      "review": {
        "startedAtUtc": "REPLACE_WITH_ISO_8601_UTC_START",
        "endedAtUtc": "REPLACE_WITH_ISO_8601_UTC_END",
        "signatureUtc": "REPLACE_WITH_ISO_8601_UTC_SIGNATURE_TIME",
        "reviewReference": "REPLACE_WITH_REVIEW_REFERENCE",
        "signatureMethod": "PGP_DETACHED_SIGNATURE",
        "signatureVerificationReference": "REPLACE_WITH_INDEPENDENT_SIGNATURE_VERIFICATION_REFERENCE"
      },
      "gateDecisions": [
        {
          "gateId": "AC-UX-01",
          "contentDecision": "NOT_VERIFIED",
          "authenticityDecision": "NOT_VERIFIED",
          "evidenceReference": "REPLACE_WITH_EXACT_EVIDENCE_REFERENCE",
          "rationale": "REPLACE_WITH_COMPLETED_HUMAN_RATIONALE"
        },
        {
          "gateId": "AC-UX-02",
          "contentDecision": "NOT_VERIFIED",
          "authenticityDecision": "NOT_VERIFIED",
          "evidenceReference": "REPLACE_WITH_EXACT_EVIDENCE_REFERENCE",
          "rationale": "REPLACE_WITH_COMPLETED_HUMAN_RATIONALE"
        },
        {
          "gateId": "AC-UX-03",
          "contentDecision": "NOT_VERIFIED",
          "authenticityDecision": "NOT_VERIFIED",
          "evidenceReference": "REPLACE_WITH_EXACT_EVIDENCE_REFERENCE",
          "rationale": "REPLACE_WITH_COMPLETED_HUMAN_RATIONALE"
        },
        {
          "gateId": "AC-UX-04",
          "contentDecision": "NOT_VERIFIED",
          "authenticityDecision": "NOT_VERIFIED",
          "evidenceReference": "REPLACE_WITH_EXACT_EVIDENCE_REFERENCE",
          "rationale": "REPLACE_WITH_COMPLETED_HUMAN_RATIONALE"
        }
      ]
    }
  }
}
